{
  "$schema": "https://json-schema.org/draft/2020-12/schema",
  "$id": "https://mila.example/schemas/part1/study_manifest.schema.json",
  "title": "Part 1 model-independent study manifest",
  "type": "object",
  "additionalProperties": false,
  "required": ["schema_name", "schema_version", "study_id", "study_manifest_hash", "question_source_repository", "question_source_revision", "question_manifest_hash", "subjects", "subject_quotas", "question_sampling_seed", "scientific_protocol_version", "checkpoint_fractions", "checkpoint_placement_contract", "entropy_contract", "natural_answer_validity_rule", "status_contract_version", "calibration_contract", "bootstrap_contract", "primary_auroc_feature_registry", "within_question_analysis", "switching_stabilization_contract", "repetition_policy", "compatible_raw_record_schema_versions", "analysis_contract_version"],
  "properties": {
    "schema_name": {"const": "part1_study_manifest"},
    "schema_version": {"const": "1.1.0"},
    "study_id": {"type": "string", "pattern": "^[0-9a-f]{64}$"},
    "study_manifest_hash": {"type": "string", "pattern": "^[0-9a-f]{64}$"},
    "question_source_repository": {"const": "cais/mmlu"},
    "question_source_revision": {"type": "string", "pattern": "^[0-9a-f]{40}$"},
    "question_manifest_hash": {"type": "string", "pattern": "^[0-9a-f]{64}$"},
    "subjects": {"const": ["high_school_mathematics", "high_school_physics", "high_school_chemistry", "high_school_biology", "high_school_psychology"]},
    "subject_quotas": {"const": {"high_school_mathematics": 100, "high_school_physics": 100, "high_school_chemistry": 100, "high_school_biology": 100, "high_school_psychology": 100}},
    "question_sampling_seed": {"const": 42},
    "scientific_protocol_version": {"type": "string", "minLength": 1},
    "checkpoint_fractions": {"const": [0.0, 0.1, 0.2, 0.3, 0.4, 0.5, 0.6, 0.7, 0.8, 0.9, 1.0]},
    "checkpoint_placement_contract": {"type": "object", "minProperties": 1},
    "entropy_contract": {"type": "object", "minProperties": 1},
    "natural_answer_validity_rule": {"type": "object", "minProperties": 1},
    "status_contract_version": {"type": "string", "minLength": 1},
    "calibration_contract": {"type": "object", "minProperties": 1},
    "bootstrap_contract": {"type": "object", "minProperties": 1},
    "primary_auroc_feature_registry": {"type": "array", "minItems": 1, "items": {"type": "string"}},
    "within_question_analysis": {"type": "object", "minProperties": 1},
    "switching_stabilization_contract": {"type": "object", "minProperties": 1},
    "repetition_policy": {"type": "string", "minLength": 1},
    "compatible_raw_record_schema_versions": {"type": "array", "minItems": 1, "uniqueItems": true, "items": {"type": "string"}},
    "analysis_contract_version": {"type": "string", "minLength": 1}
  }
}
