{"analysis_contract_version":"part1-analysis-v1","bootstrap_contract":{"confidence_interval_percent":95,"development_replicates":1000,"final_replicates":5000,"minimum_valid_fraction":0.95,"seed":42,"unit":"subject_stratified_question","version":"bootstrap-v1"},"calibration_contract":{"all_checkpoint_fractions":[0.0,0.1,0.2,0.3,0.4,0.5,0.6,0.7,0.8,0.9,1.0],"ece_bins":10,"main_checkpoint_fractions":[0.0,0.5,1.0],"version":"calibration-v1"},"checkpoint_fractions":[0.0,0.1,0.2,0.3,0.4,0.5,0.6,0.7,0.8,0.9,1.0],"checkpoint_placement_contract":{"actual_fraction_zero_reasoning":null,"formula":"clamp(round(requested_fraction*n_reasoning),0,n_reasoning)","version":"ties-even-v1"},"compatible_raw_record_schema_versions":["1.0.0"],"entropy_contract":{"checkpoint":"renormalized_ad_answer_entropy_nats","natural":"raw_full_vocabulary_reasoning_token_entropy_nats","tail":{"aggregation":"arithmetic_mean","value_when_n_reasoning_is_zero":null,"window_region":"final_recognized_reasoning_tokens","window_size_formula":"max(1,ceil(0.10*n_reasoning))"},"version":"entropy-v1"},"natural_answer_validity_rule":{"domain":["A","B","C","D"],"region":"after_first_valid_reasoning_close","version":"post-close-v1"},"primary_auroc_feature_registry":["negative_mean_reasoning_entropy","negative_tail_reasoning_entropy","negative_answer_entropy_fraction_0.0","negative_answer_entropy_fraction_0.5","negative_answer_entropy_fraction_1.0","natural_verbalized_confidence","maximum_ad_probability_fraction_0.0","maximum_ad_probability_fraction_0.5","maximum_ad_probability_fraction_1.0","negative_answer_switch_count","negative_stabilization_fraction"],"question_manifest_hash":"dd379f48322d6eb07c309101361738a965be320b4124bb45bd44723b1abe474d","question_sampling_seed":42,"question_source_repository":"cais/mmlu","question_source_revision":"c30699e8356da336a370243923dbaf21066bb9fe","repetition_policy":"preserve-successful-output","schema_name":"part1_study_manifest","schema_version":"1.1.0","scientific_protocol_version":"part1-science-v1","status_contract_version":"part1-status-v1","study_id":"4c0cd6c823745710264cd98111d943e275dc37bbc90385c81a96355f5620d4c5","study_manifest_hash":"859eecd5e0437a901555d5fd2d99692feccb5257df16de60bfe0fe648626142b","subject_quotas":{"high_school_biology":100,"high_school_chemistry":100,"high_school_mathematics":100,"high_school_physics":100,"high_school_psychology":100},"subjects":["high_school_mathematics","high_school_physics","high_school_chemistry","high_school_biology","high_school_psychology"],"switching_stabilization_contract":{"aliases_are_transitions":false,"missing_breaks_adjacency":true,"stabilization_reference":"final_valid_forced_checkpoint_answer","version":"trajectory-v1"},"within_question_analysis":{"eligibility":"at_least_one_correct_and_one_incorrect_natural_run","question_weighting":"equal","version":"paired-v1"}}
